nohup: ignoring input
wandb: Currently logged in as: xuanzhu_07 (xuanzhu_07-university-of-sydney). Use `wandb login --relogin` to force relogin
wandb: wandb version 0.19.8 is available!  To upgrade, please run:
wandb:  $ pip install wandb --upgrade
wandb: Tracking run with wandb version 0.16.3
wandb: Run data is saved locally in /home/yxma/hzx/hzx/hzx/rand_defence/wandb/run-20250325_180907-ows3vkis
wandb: Run `wandb offline` to turn off syncing.
wandb: Syncing run fanciful-disco-26
wandb: ⭐️ View project at https://wandb.ai/xuanzhu_07-university-of-sydney/-Test-blacktransfer
wandb: 🚀 View run at https://wandb.ai/xuanzhu_07-university-of-sydney/-Test-blacktransfer/runs/ows3vkis
[2025/03/25 18:09:11] - Namespace(batch_size=128, data_dir='~/datasets/CIFAR10/', dataset='cifar10', epochs=200, network='ResNet18', worker=4, lr_schedule='multistep', lr_min=0.0, lr_max=0.1, weight_decay=0.0005, momentum=0.9, none_random_training=True, rand_deform_training=False, randpos_deform_training=True, randpos_multi_deform_training=False, is_n_repeat=False, reNum=5, only_adv_randpos_training=False, rand_path_training=False, epsilon=8, alpha=2, c=0.0001, steps=1000, seed=0, attack_iters=20, restarts=1, save_dir='logs/ResNet18_DeformableConvolution', pretrain='/home/yxma/hzx/hzx/hzx/rand_defence/ckpt/cifar10/ResNet18/ckpt/model_20240928164626.pth', continue_training=False, lb=2048, pos=0, eot=False, hang=False, device=0)
[2025/03/25 18:09:11] - Dataset: cifar10
[2025/03/25 18:09:13] - Evaluating with standard images with random mask...
Process ID: 175486
Pretrain model path: /home/yxma/hzx/hzx/hzx/rand_defence/ckpt/cifar10/ResNet18/ckpt/model_20240928164626.pth
Does pretrain model path exist? True
Files already downloaded and verified
Files already downloaded and verified
ResNetPartmask5(
  (conv1): Conv2d(3, 64, kernel_size=(3, 3), stride=(1, 1), padding=(1, 1), bias=False)
  (bn1): BatchNorm2d(64, eps=1e-05, momentum=0.1, affine=True, track_running_stats=True)
  (layer1): ModuleList(
    (0): RandonBasicBlock02(
      (bn1): BatchNorm2d(64, eps=1e-05, momentum=0.1, affine=True, track_running_stats=True)
      (conv1): MaskedConv2d(64, 64, kernel_size=(5, 5), stride=(1, 1), padding=(2, 2), bias=False)
      (bn2): BatchNorm2d(64, eps=1e-05, momentum=0.1, affine=True, track_running_stats=True)
      (conv2): Conv2d(64, 64, kernel_size=(3, 3), stride=(1, 1), padding=(1, 1), bias=False)
      (shortcut): Sequential()
    )
  )
  (layer11): ModuleList(
    (0): BasicBlock(
      (bn1): BatchNorm2d(64, eps=1e-05, momentum=0.1, affine=True, track_running_stats=True)
      (conv1): Conv2d(64, 64, kernel_size=(3, 3), stride=(1, 1), padding=(1, 1), bias=False)
      (bn2): BatchNorm2d(64, eps=1e-05, momentum=0.1, affine=True, track_running_stats=True)
      (conv2): Conv2d(64, 64, kernel_size=(3, 3), stride=(1, 1), padding=(1, 1), bias=False)
      (shortcut): Sequential()
    )
  )
  (layer2): ModuleList(
    (0): BasicBlock(
      (bn1): BatchNorm2d(128, eps=1e-05, momentum=0.1, affine=True, track_running_stats=True)
      (conv1): Conv2d(64, 128, kernel_size=(3, 3), stride=(2, 2), padding=(1, 1), bias=False)
      (bn2): BatchNorm2d(128, eps=1e-05, momentum=0.1, affine=True, track_running_stats=True)
      (conv2): Conv2d(128, 128, kernel_size=(3, 3), stride=(1, 1), padding=(1, 1), bias=False)
      (shortcut): Sequential(
        (0): Conv2d(64, 128, kernel_size=(1, 1), stride=(2, 2), bias=False)
        (1): BatchNorm2d(128, eps=1e-05, momentum=0.1, affine=True, track_running_stats=True)
      )
    )
    (1): BasicBlock(
      (bn1): BatchNorm2d(128, eps=1e-05, momentum=0.1, affine=True, track_running_stats=True)
      (conv1): Conv2d(128, 128, kernel_size=(3, 3), stride=(1, 1), padding=(1, 1), bias=False)
      (bn2): BatchNorm2d(128, eps=1e-05, momentum=0.1, affine=True, track_running_stats=True)
      (conv2): Conv2d(128, 128, kernel_size=(3, 3), stride=(1, 1), padding=(1, 1), bias=False)
      (shortcut): Sequential()
    )
  )
  (layer3): ModuleList(
    (0): BasicBlock(
      (bn1): BatchNorm2d(256, eps=1e-05, momentum=0.1, affine=True, track_running_stats=True)
      (conv1): Conv2d(128, 256, kernel_size=(3, 3), stride=(2, 2), padding=(1, 1), bias=False)
      (bn2): BatchNorm2d(256, eps=1e-05, momentum=0.1, affine=True, track_running_stats=True)
      (conv2): Conv2d(256, 256, kernel_size=(3, 3), stride=(1, 1), padding=(1, 1), bias=False)
      (shortcut): Sequential(
        (0): Conv2d(128, 256, kernel_size=(1, 1), stride=(2, 2), bias=False)
        (1): BatchNorm2d(256, eps=1e-05, momentum=0.1, affine=True, track_running_stats=True)
      )
    )
    (1): BasicBlock(
      (bn1): BatchNorm2d(256, eps=1e-05, momentum=0.1, affine=True, track_running_stats=True)
      (conv1): Conv2d(256, 256, kernel_size=(3, 3), stride=(1, 1), padding=(1, 1), bias=False)
      (bn2): BatchNorm2d(256, eps=1e-05, momentum=0.1, affine=True, track_running_stats=True)
      (conv2): Conv2d(256, 256, kernel_size=(3, 3), stride=(1, 1), padding=(1, 1), bias=False)
      (shortcut): Sequential()
    )
  )
  (layer4): ModuleList(
    (0): BasicBlock(
      (bn1): BatchNorm2d(512, eps=1e-05, momentum=0.1, affine=True, track_running_stats=True)
      (conv1): Conv2d(256, 512, kernel_size=(3, 3), stride=(2, 2), padding=(1, 1), bias=False)
      (bn2): BatchNorm2d(512, eps=1e-05, momentum=0.1, affine=True, track_running_stats=True)
      (conv2): Conv2d(512, 512, kernel_size=(3, 3), stride=(1, 1), padding=(1, 1), bias=False)
      (shortcut): Sequential(
        (0): Conv2d(256, 512, kernel_size=(1, 1), stride=(2, 2), bias=False)
        (1): BatchNorm2d(512, eps=1e-05, momentum=0.1, affine=True, track_running_stats=True)
      )
    )
    (1): BasicBlock(
      (bn1): BatchNorm2d(512, eps=1e-05, momentum=0.1, affine=True, track_running_stats=True)
      (conv1): Conv2d(512, 512, kernel_size=(3, 3), stride=(1, 1), padding=(1, 1), bias=False)
      (bn2): BatchNorm2d(512, eps=1e-05, momentum=0.1, affine=True, track_running_stats=True)
      (conv2): Conv2d(512, 512, kernel_size=(3, 3), stride=(1, 1), padding=(1, 1), bias=False)
      (shortcut): Sequential()
    )
  )
  (linear): Linear(in_features=512, out_features=10, bias=True)
  (normalize): NormalizeByChannelMeanStd(mean=tensor([0.4914, 0.4822, 0.4465], device='cuda:0'), std=tensor([0.2471, 0.2435, 0.2616], device='cuda:0'))
)
Different keys:
normalize.mean
normalize.std
Nature:
[2025/03/25 18:09:14] - Nature Acc Mean: 0.8907, Std: 0.0000
tensor([[[[1., 0., 0., 0., 0.],
          [0., 0., 0., 0., 0.],
          [0., 0., 0., 0., 0.],
          [0., 0., 0., 0., 0.],
          [0., 1., 0., 0., 0.]]],


        [[[1., 0., 0., 0., 0.],
          [0., 0., 0., 0., 0.],
          [0., 0., 0., 0., 0.],
          [0., 0., 0., 0., 0.],
          [0., 1., 0., 0., 0.]]],


        [[[1., 0., 0., 0., 0.],
          [0., 0., 0., 0., 0.],
          [0., 0., 0., 0., 0.],
          [0., 0., 0., 0., 0.],
          [0., 1., 0., 0., 0.]]],


        ...,


        [[[1., 0., 0., 0., 0.],
          [0., 0., 0., 0., 0.],
          [0., 0., 0., 0., 0.],
          [0., 0., 0., 0., 0.],
          [0., 1., 0., 0., 0.]]],


        [[[1., 0., 0., 0., 0.],
          [0., 0., 0., 0., 0.],
          [0., 0., 0., 0., 0.],
          [0., 0., 0., 0., 0.],
          [0., 1., 0., 0., 0.]]],


        [[[1., 0., 0., 0., 0.],
          [0., 0., 0., 0., 0.],
          [0., 0., 0., 0., 0.],
          [0., 0., 0., 0., 0.],
          [0., 1., 0., 0., 0.]]]], device='cuda:0')
FGSM attacking
=> Loading model resnet18 from torchvision.models
[00:00<?,?it/s][00:00<00:43, 1.78it/s][00:00<00:10, 7.07it/s][00:00<00:06,11.26it/s][00:00<00:04,14.48it/s][00:01<00:03,16.89it/s][00:01<00:03,18.64it/s][00:01<00:03,19.92it/s][00:01<00:02,20.84it/s][00:01<00:02,21.49it/s][00:01<00:02,21.95it/s][00:01<00:02,22.27it/s][00:01<00:01,22.50it/s][00:02<00:01,22.67it/s][00:02<00:01,22.78it/s][00:02<00:01,22.88it/s][00:02<00:01,23.04it/s][00:02<00:01,23.08it/s][00:02<00:01,23.11it/s][00:02<00:01,23.21it/s][00:03<00:00,23.26it/s][00:03<00:00,23.30it/s][00:03<00:00,23.33it/s][00:03<00:00,23.30it/s][00:03<00:00,23.32it/s][00:03<00:00,23.34it/s][00:03<00:00,23.38it/s][00:03<00:00,23.05it/s][00:03<00:00,20.09it/s][2025/03/25 18:09:18] - FGSM - Run 79: Accuracy: 0.8497

[00:00<?,?it/s][00:00<00:03,23.08it/s][00:00<00:03,23.30it/s][00:00<00:02,23.39it/s][00:00<00:02,23.32it/s][00:00<00:02,23.36it/s][00:00<00:02,23.41it/s][00:00<00:02,23.42it/s][00:01<00:02,23.44it/s][00:01<00:02,23.41it/s][00:01<00:02,23.41it/s][00:01<00:01,23.43it/s][00:01<00:01,23.42it/s][00:01<00:01,23.42it/s][00:01<00:01,23.42it/s][00:01<00:01,23.35it/s][00:02<00:01,23.36it/s][00:02<00:01,23.41it/s][00:02<00:01,23.36it/s][00:02<00:00,23.36it/s][00:02<00:00,23.40it/s][00:02<00:00,23.28it/s][00:02<00:00,23.34it/s][00:02<00:00,23.36it/s][00:03<00:00,23.36it/s][00:03<00:00,23.45it/s][00:03<00:00,23.49it/s][00:03<00:00,23.62it/s][2025/03/25 18:09:22] - FGSM - Run 79: Accuracy: 0.8493

[00:00<?,?it/s][00:00<00:03,23.01it/s][00:00<00:03,23.23it/s][00:00<00:03,23.27it/s][00:00<00:02,23.35it/s][00:00<00:02,23.34it/s][00:00<00:02,23.33it/s][00:00<00:02,23.36it/s][00:01<00:02,23.35it/s][00:01<00:02,23.33it/s][00:01<00:02,23.37it/s][00:01<00:01,23.34it/s][00:01<00:01,23.37it/s][00:01<00:01,23.39it/s][00:01<00:01,23.34it/s][00:01<00:01,23.36it/s][00:02<00:01,23.30it/s][00:02<00:01,23.34it/s][00:02<00:01,23.33it/s][00:02<00:00,23.23it/s][00:02<00:00,23.19it/s][00:02<00:00,23.16it/s][00:02<00:00,23.13it/s][00:02<00:00,23.13it/s][00:03<00:00,23.13it/s][00:03<00:00,23.15it/s][00:03<00:00,23.15it/s][00:03<00:00,23.48it/s][2025/03/25 18:09:25] - FGSM - Run 79: Accuracy: 0.8494
[2025/03/25 18:09:25] - FGSM Mean: 0.8495, Std: 0.0002

FMAA attacking
=> Loading model resnet18 from torchvision.models
[00:00<?,?it/s][00:15<19:47,15.22s/it][00:30<19:33,15.23s/it][00:45<19:11,15.15s/it][01:00<18:49,15.06s/it][01:15<18:29,15.00s/it][01:30<18:12,14.96s/it][01:45<17:58,14.98s/it][02:00<17:43,14.98s/it][02:15<17:27,14.97s/it][02:30<17:12,14.97s/it][02:45<16:56,14.95s/it][03:00<16:47,15.04s/it][03:15<16:30,15.01s/it][03:30<16:13,14.97s/it][03:45<15:57,14.97s/it][03:59<15:39,14.91s/it][04:14<15:23,14.90s/it][04:29<15:09,14.92s/it][04:44<14:55,14.93s/it][04:59<14:42,14.96s/it][05:14<14:25,14.92s/it][05:29<14:10,14.92s/it][05:44<13:55,14.93s/it][05:59<13:42,14.95s/it][06:14<13:28,14.98s/it][06:29<13:11,14.94s/it][06:44<12:54,14.89s/it][06:59<12:42,14.94s/it][07:14<12:28,14.97s/it][07:29<12:13,14.97s/it][07:44<11:59,14.99s/it][07:59<11:42,14.96s/it][08:13<11:28,14.97s/it][08:28<11:13,14.96s/it][08:43<10:55,14.89s/it][08:58<10:43,14.97s/it][09:13<10:29,15.00s/it][09:28<10:14,14.99s/it][09:43<09:59,14.99s/it][09:58<09:45,15.01s/it][10:13<09:29,14.99s/it][10:28<09:16,15.03s/it][10:44<09:01,15.04s/it][10:59<08:46,15.05s/it][11:14<08:30,15.02s/it][11:28<08:14,14.99s/it][11:43<07:57,14.92s/it][11:58<07:42,14.92s/it][12:13<07:26,14.89s/it][12:28<07:12,14.90s/it][12:43<06:59,14.99s/it][12:58<06:45,15.01s/it][13:14<06:33,15.12s/it][13:29<06:19,15.19s/it][13:44<06:05,15.23s/it][13:59<05:50,15.23s/it][14:15<05:34,15.21s/it][14:30<05:18,15.18s/it][14:44<05:01,15.06s/it][14:59<04:44,14.98s/it][15:14<04:29,14.98s/it][15:29<04:15,15.00s/it][15:44<03:59,14.94s/it][15:59<03:45,15.00s/it][16:14<03:30,15.04s/it][16:30<03:16,15.12s/it][16:45<03:00,15.05s/it][16:59<02:45,15.01s/it][17:14<02:29,14.94s/it][17:29<02:14,14.93s/it][17:44<01:59,14.99s/it][17:59<01:44,14.98s/it][18:14<01:30,15.00s/it][18:30<01:15,15.11s/it][18:45<01:00,15.07s/it][19:00<00:45,15.04s/it][19:15<00:30,15.04s/it][19:30<00:14,14.98s/it][19:32<00:00,11.13s/it][19:32<00:00,14.84s/it][2025/03/25 18:28:57] - fmaa - Run 79: Accuracy: 0.8831

[00:00<?,?it/s][00:14<19:18,14.85s/it][00:29<19:01,14.83s/it][00:44<18:46,14.82s/it][00:59<18:34,14.85s/it][01:14<18:22,14.89s/it][01:29<18:07,14.89s/it][01:44<17:53,14.91s/it][01:59<17:37,14.90s/it][02:13<17:21,14.88s/it][02:28<17:09,14.92s/it][02:44<16:58,14.98s/it][02:59<16:46,15.02s/it][03:14<16:31,15.03s/it][03:29<16:15,15.01s/it][03:44<15:58,14.98s/it][03:58<15:41,14.95s/it][04:13<15:28,14.98s/it][04:29<15:17,15.04s/it][04:44<15:05,15.09s/it][04:59<14:51,15.11s/it][05:14<14:37,15.13s/it][05:29<14:25,15.18s/it][05:45<14:09,15.17s/it][05:59<13:49,15.08s/it][06:15<13:33,15.07s/it][06:30<13:17,15.05s/it][06:44<12:58,14.96s/it][06:59<12:42,14.95s/it][07:14<12:26,14.93s/it][07:29<12:12,14.95s/it][07:44<11:56,14.93s/it][07:59<11:41,14.93s/it][08:14<11:26,14.93s/it][08:29<11:12,14.93s/it][08:44<10:57,14.94s/it][08:59<10:43,14.96s/it][09:14<10:28,14.96s/it][09:29<10:12,14.93s/it][09:43<09:53,14.85s/it][09:58<09:37,14.81s/it][10:13<09:23,14.82s/it][10:28<09:09,14.86s/it][10:43<08:55,14.87s/it][10:58<08:40,14.87s/it][11:12<08:24,14.85s/it][11:27<08:11,14.88s/it][11:42<07:57,14.91s/it][11:57<07:42,14.93s/it][12:12<07:27,14.93s/it][12:27<07:13,14.93s/it][12:42<06:57,14.92s/it][12:57<06:41,14.89s/it][13:12<06:27,14.90s/it][13:27<06:12,14.88s/it][13:42<05:58,14.94s/it][13:57<05:43,14.94s/it][14:12<05:28,14.95s/it][14:26<05:12,14.89s/it][14:41<04:57,14.88s/it][14:56<04:41,14.82s/it][15:11<04:26,14.79s/it][15:25<04:11,14.81s/it][15:40<03:57,14.83s/it][15:55<03:41,14.79s/it][16:10<03:27,14.83s/it][16:25<03:13,14.85s/it][16:40<02:58,14.87s/it][16:55<02:43,14.91s/it][17:10<02:29,14.91s/it][17:25<02:14,14.91s/it][17:39<01:59,14.90s/it][17:54<01:44,14.88s/it][18:09<01:29,14.86s/it][18:24<01:14,14.85s/it][18:39<00:59,14.86s/it][18:54<00:44,14.88s/it][19:09<00:29,14.93s/it][19:24<00:14,14.90s/it][19:26<00:00,11.05s/it][19:26<00:00,14.76s/it][2025/03/25 18:48:24] - fmaa - Run 79: Accuracy: 0.8846

[00:00<?,?it/s][00:14<19:16,14.82s/it][00:30<19:19,15.06s/it][00:45<19:03,15.05s/it][01:00<18:46,15.02s/it][01:14<18:25,14.93s/it][01:29<18:08,14.91s/it][01:44<17:52,14.89s/it][01:59<17:37,14.89s/it][02:14<17:23,14.91s/it][02:29<17:10,14.93s/it][02:44<16:55,14.93s/it][02:59<16:39,14.92s/it][03:14<16:26,14.95s/it][03:29<16:14,14.99s/it][03:44<16:00,15.01s/it][03:59<15:49,15.07s/it][04:14<15:35,15.09s/it][04:29<15:22,15.12s/it][04:45<15:07,15.13s/it][05:00<14:53,15.14s/it][05:15<14:36,15.11s/it][05:30<14:21,15.11s/it][05:45<14:06,15.12s/it][06:00<13:50,15.10s/it][06:15<13:33,15.07s/it][06:30<13:18,15.07s/it][06:45<13:03,15.07s/it][07:00<12:49,15.09s/it][07:15<12:34,15.09s/it][07:31<12:21,15.13s/it][07:46<12:07,15.16s/it][08:01<11:47,15.05s/it][08:15<11:28,14.96s/it][08:30<11:10,14.90s/it][08:45<10:54,14.87s/it][09:00<10:38,14.86s/it][09:15<10:23,14.84s/it][09:29<10:08,14.83s/it][09:44<09:53,14.83s/it][09:59<09:39,14.85s/it][10:14<09:25,14.87s/it][10:29<09:11,14.92s/it][10:44<08:56,14.89s/it][10:59<08:41,14.90s/it][11:14<08:28,14.97s/it][11:29<08:15,15.03s/it][11:44<07:59,14.99s/it][11:59<07:43,14.95s/it][12:14<07:28,14.95s/it][12:29<07:14,14.99s/it][12:44<07:00,15.03s/it][12:59<06:46,15.05s/it][13:14<06:32,15.08s/it][13:29<06:17,15.10s/it][13:45<06:02,15.12s/it][13:59<05:46,15.05s/it][14:14<05:30,15.01s/it][14:29<05:15,15.02s/it][14:44<05:00,15.01s/it][15:00<04:46,15.07s/it][15:15<04:31,15.10s/it][15:30<04:15,15.05s/it][15:45<04:00,15.04s/it][16:00<03:45,15.06s/it][16:15<03:30,15.06s/it][16:30<03:16,15.09s/it][16:45<03:01,15.14s/it][17:00<02:46,15.11s/it][17:15<02:30,15.01s/it][17:30<02:14,14.95s/it][17:45<01:59,14.94s/it][18:00<01:44,14.93s/it][18:15<01:29,14.96s/it][18:30<01:15,15.02s/it][18:45<00:59,15.00s/it][19:00<00:44,14.98s/it][19:15<00:29,15.00s/it][19:30<00:14,14.97s/it][19:32<00:00,11.14s/it][19:32<00:00,14.84s/it][2025/03/25 19:07:56] - fmaa - Run 79: Accuracy: 0.8850
[2025/03/25 19:07:56] - fmaa Mean: 0.8842, Std: 0.0008

PGN attacking
=> Loading model resnet18 from torchvision.models
[00:00<?,?it/s][00:15<19:51,15.27s/it][00:30<19:36,15.28s/it][00:45<19:21,15.29s/it][01:01<19:07,15.30s/it][01:16<18:51,15.29s/it][01:31<18:36,15.29s/it][01:47<18:20,15.29s/it][02:02<18:05,15.28s/it][02:17<17:49,15.29s/it][02:32<17:34,15.29s/it][02:48<17:19,15.29s/it][03:03<17:04,15.29s/it][03:18<16:48,15.28s/it][03:33<16:33,15.28s/it][03:49<16:17,15.28s/it][04:04<16:03,15.29s/it][04:19<15:47,15.29s/it][04:35<15:32,15.28s/it][04:50<15:16,15.28s/it][05:05<15:01,15.28s/it][05:20<14:46,15.28s/it][05:36<14:31,15.28s/it][05:51<14:15,15.28s/it][06:06<14:00,15.28s/it][06:22<13:44,15.27s/it][06:37<13:29,15.27s/it][06:52<13:14,15.28s/it][07:07<12:59,15.28s/it][07:23<12:44,15.28s/it][07:38<12:29,15.29s/it][07:53<12:13,15.29s/it][08:09<11:58,15.29s/it][08:24<11:43,15.29s/it][08:39<11:28,15.29s/it][08:54<11:12,15.29s/it][09:10<10:57,15.28s/it][09:25<10:41,15.28s/it][09:40<10:26,15.28s/it][09:56<10:11,15.29s/it][10:11<09:56,15.29s/it][10:26<09:40,15.28s/it][10:41<09:25,15.29s/it][10:57<09:10,15.29s/it][11:12<08:54,15.28s/it][11:27<08:39,15.28s/it][11:43<08:24,15.28s/it][11:58<08:08,15.27s/it][12:13<07:53,15.27s/it][12:28<07:38,15.28s/it][12:44<07:23,15.28s/it][12:59<07:07,15.28s/it][13:14<06:52,15.27s/it][13:29<06:37,15.27s/it][13:45<06:21,15.28s/it][14:00<06:06,15.28s/it][14:15<05:51,15.29s/it][14:31<05:36,15.29s/it][14:46<05:21,15.29s/it][15:01<05:05,15.29s/it][15:16<04:50,15.29s/it][15:32<04:35,15.29s/it][15:47<04:20,15.30s/it][16:02<04:04,15.29s/it][16:18<03:49,15.29s/it][16:33<03:33,15.28s/it][16:48<03:18,15.28s/it][17:03<03:03,15.28s/it][17:19<02:48,15.28s/it][17:34<02:32,15.29s/it][17:49<02:17,15.29s/it][18:05<02:02,15.28s/it][18:20<01:46,15.28s/it][18:35<01:31,15.29s/it][18:50<01:16,15.29s/it][19:06<01:01,15.29s/it][19:21<00:45,15.29s/it][19:36<00:30,15.29s/it][19:52<00:15,15.29s/it][19:54<00:00,11.38s/it][19:54<00:00,15.12s/it][2025/03/25 19:27:51] - pgn - Run 79: Accuracy: 0.8655

[00:00<?,?it/s][00:15<19:52,15.29s/it][00:30<19:37,15.29s/it][00:45<19:21,15.29s/it][01:01<19:06,15.29s/it][01:16<18:50,15.28s/it][01:31<18:35,15.28s/it][01:46<18:19,15.28s/it][02:02<18:04,15.27s/it][02:17<17:49,15.27s/it][02:32<17:34,15.28s/it][02:48<17:19,15.29s/it][03:03<17:04,15.29s/it][03:18<16:48,15.29s/it][03:33<16:34,15.29s/it][03:49<16:18,15.29s/it][04:04<16:02,15.28s/it][04:19<15:47,15.29s/it][04:35<15:32,15.29s/it][04:50<15:17,15.30s/it][05:05<15:02,15.29s/it][05:20<14:46,15.29s/it][05:36<14:31,15.28s/it][05:51<14:15,15.28s/it][06:06<14:00,15.28s/it][06:22<13:45,15.28s/it][06:37<13:30,15.29s/it][06:52<13:14,15.29s/it][07:07<12:59,15.29s/it][07:23<12:44,15.29s/it][07:38<12:28,15.29s/it][07:53<12:13,15.28s/it][08:09<11:58,15.29s/it][08:24<11:43,15.28s/it][08:39<11:27,15.28s/it][08:54<11:12,15.28s/it][09:10<10:57,15.28s/it][09:25<10:42,15.29s/it][09:40<10:27,15.30s/it][09:56<10:11,15.29s/it][10:11<09:56,15.30s/it][10:26<09:41,15.30s/it][10:42<09:25,15.29s/it][10:57<09:10,15.30s/it][11:12<08:55,15.30s/it][11:27<08:40,15.30s/it][11:43<08:24,15.29s/it][11:58<08:09,15.29s/it][12:13<07:53,15.29s/it][12:29<07:38,15.29s/it][12:44<07:23,15.29s/it][12:59<07:07,15.28s/it][13:14<06:52,15.28s/it][13:30<06:37,15.28s/it][13:45<06:22,15.28s/it][14:00<06:06,15.29s/it][14:16<05:51,15.29s/it][14:31<05:36,15.29s/it][14:46<05:21,15.29s/it][15:01<05:05,15.29s/it][15:17<04:50,15.29s/it][15:32<04:35,15.29s/it][15:47<04:20,15.29s/it][16:03<04:04,15.29s/it][16:18<03:49,15.29s/it][16:33<03:34,15.29s/it][16:48<03:18,15.29s/it][17:04<03:03,15.30s/it][17:19<02:48,15.30s/it][17:34<02:33,15.30s/it][17:50<02:17,15.30s/it][18:05<02:02,15.29s/it][18:20<01:47,15.29s/it][18:36<01:31,15.29s/it][18:51<01:16,15.28s/it][19:06<01:01,15.28s/it][19:21<00:45,15.28s/it][19:37<00:30,15.29s/it][19:52<00:15,15.29s/it][19:54<00:00,11.37s/it][19:54<00:00,15.12s/it][2025/03/25 19:47:46] - pgn - Run 79: Accuracy: 0.8673

[00:00<?,?it/s][00:15<19:52,15.29s/it][00:30<19:37,15.29s/it][00:45<19:22,15.29s/it][01:01<19:06,15.29s/it][01:16<18:51,15.29s/it][01:31<18:36,15.29s/it][01:47<18:20,15.29s/it][02:02<18:05,15.29s/it][02:17<17:50,15.29s/it][02:32<17:35,15.29s/it][02:48<17:19,15.29s/it][03:03<17:04,15.29s/it][03:18<16:49,15.30s/it][03:34<16:34,15.30s/it][03:49<16:18,15.30s/it][04:04<16:03,15.29s/it][04:19<15:48,15.29s/it][04:35<15:32,15.29s/it][04:50<15:17,15.29s/it][05:05<15:01,15.28s/it][05:21<14:46,15.28s/it][05:36<14:30,15.28s/it][05:51<14:15,15.28s/it][06:06<14:00,15.28s/it][06:22<13:44,15.27s/it][06:37<13:29,15.27s/it][06:52<13:14,15.28s/it][07:08<12:59,15.28s/it][07:23<12:44,15.29s/it][07:38<12:28,15.28s/it][07:53<12:13,15.28s/it][08:09<11:58,15.28s/it][08:24<11:43,15.29s/it][08:39<11:27,15.29s/it][08:55<11:12,15.29s/it][09:10<10:57,15.28s/it][09:25<10:41,15.28s/it][09:40<10:26,15.28s/it][09:56<10:11,15.28s/it][10:11<09:55,15.28s/it][10:26<09:40,15.29s/it][10:42<09:25,15.30s/it][10:57<09:10,15.30s/it][11:12<08:55,15.29s/it][11:27<08:39,15.29s/it][11:43<08:24,15.28s/it][11:58<08:09,15.29s/it][12:13<07:53,15.28s/it][12:29<07:38,15.29s/it][12:44<07:23,15.29s/it][12:59<07:08,15.29s/it][13:14<06:52,15.29s/it][13:30<06:37,15.29s/it][13:45<06:22,15.29s/it][14:00<06:06,15.29s/it][14:16<05:51,15.28s/it][14:31<05:36,15.29s/it][14:46<05:20,15.28s/it][15:01<05:05,15.29s/it][15:17<04:50,15.28s/it][15:32<04:34,15.28s/it][15:47<04:19,15.28s/it][16:03<04:04,15.28s/it][16:18<03:49,15.28s/it][16:33<03:33,15.28s/it][16:48<03:18,15.29s/it][17:04<03:03,15.29s/it][17:19<02:48,15.29s/it][17:34<02:32,15.28s/it][17:50<02:17,15.29s/it][18:05<02:02,15.29s/it][18:20<01:46,15.28s/it][18:35<01:31,15.28s/it][18:51<01:16,15.28s/it][19:06<01:01,15.27s/it][19:21<00:45,15.28s/it][19:36<00:30,15.28s/it][19:52<00:15,15.28s/it][19:54<00:00,11.39s/it][19:54<00:00,15.12s/it][2025/03/25 20:07:41] - pgn - Run 79: Accuracy: 0.8690
[2025/03/25 20:07:41] - pgn Mean: 0.8673, Std: 0.0014

DeCowA attacking
=> Loading model resnet18 from torchvision.models
[00:00<?,?it/s]/home/yxma/anaconda3/envs/py39_torch/lib/python3.9/site-packages/torch/functional.py:507: UserWarning: torch.meshgrid: in an upcoming release, it will be required to pass the indexing argument. (Triggered internally at ../aten/src/ATen/native/TensorShape.cpp:3549.)
  return _VF.meshgrid(tensors, **kwargs)  # type: ignore[attr-defined]
[00:16<21:04,16.22s/it][00:31<20:28,15.95s/it][00:47<20:07,15.89s/it][01:03<19:48,15.85s/it][01:19<19:32,15.84s/it][01:35<19:14,15.82s/it][01:50<18:57,15.79s/it][02:06<18:42,15.81s/it][02:22<18:26,15.80s/it][02:38<18:13,15.84s/it][02:54<17:58,15.86s/it][03:10<17:42,15.85s/it][03:26<17:26,15.86s/it][03:42<17:12,15.88s/it][03:57<16:55,15.86s/it][04:13<16:37,15.84s/it][04:29<16:20,15.81s/it][04:45<16:04,15.81s/it][05:01<15:49,15.82s/it][05:16<15:33,15.83s/it][05:32<15:17,15.83s/it][05:48<15:02,15.83s/it][06:04<14:47,15.85s/it][06:20<14:29,15.82s/it][06:36<14:15,15.85s/it][06:52<14:01,15.87s/it][07:07<13:44,15.85s/it][07:23<13:27,15.84s/it][07:39<13:10,15.81s/it][07:55<12:54,15.81s/it][08:10<12:38,15.80s/it][08:26<12:22,15.79s/it][08:42<12:07,15.83s/it][08:58<11:52,15.83s/it][09:14<11:37,15.86s/it][09:30<11:20,15.84s/it][09:46<11:04,15.83s/it][10:01<10:48,15.81s/it][10:17<10:33,15.85s/it][10:33<10:18,15.85s/it][10:49<10:02,15.85s/it][11:05<09:46,15.86s/it][11:21<09:31,15.87s/it][11:37<09:14,15.86s/it][11:52<08:58,15.83s/it][12:08<08:42,15.83s/it][12:24<08:26,15.84s/it][12:40<08:10,15.83s/it][12:56<07:54,15.82s/it][13:11<07:39,15.83s/it][13:27<07:23,15.85s/it][13:43<07:08,15.85s/it][13:59<06:51,15.83s/it][14:15<06:35,15.82s/it][14:31<06:19,15.81s/it][14:46<06:03,15.83s/it][15:02<05:48,15.84s/it][15:18<05:33,15.86s/it][15:34<05:17,15.85s/it][15:50<05:01,15.86s/it][16:06<04:45,15.87s/it][16:22<04:29,15.87s/it][16:38<04:14,15.88s/it][16:53<03:58,15.89s/it][17:09<03:42,15.88s/it][17:25<03:26,15.87s/it][17:41<03:10,15.88s/it][17:57<02:54,15.86s/it][18:13<02:38,15.84s/it][18:29<02:22,15.85s/it][18:44<02:06,15.87s/it][19:00<01:51,15.87s/it][19:16<01:35,15.84s/it][19:32<01:19,15.85s/it][19:48<01:03,15.84s/it][20:04<00:47,15.83s/it][20:19<00:31,15.81s/it][20:35<00:15,15.82s/it][20:38<00:00,11.89s/it][20:38<00:00,15.68s/it][2025/03/25 20:28:19] - DeCowA - Run 79: Accuracy: 0.8829

[00:00<?,?it/s][00:15<20:39,15.90s/it][00:31<20:22,15.88s/it][00:47<20:06,15.87s/it][01:03<19:46,15.82s/it][01:19<19:31,15.82s/it][01:35<19:16,15.84s/it][01:50<18:59,15.83s/it][02:06<18:45,15.85s/it][02:22<18:29,15.85s/it][02:38<18:13,15.84s/it][02:54<17:53,15.79s/it][03:09<17:36,15.78s/it][03:25<17:21,15.78s/it][03:41<17:05,15.78s/it][03:57<16:50,15.78s/it][04:13<16:34,15.79s/it][04:28<16:19,15.80s/it][04:44<16:03,15.80s/it][05:00<15:48,15.81s/it][05:16<15:33,15.83s/it][05:32<15:18,15.84s/it][05:47<15:01,15.81s/it][06:03<14:47,15.84s/it][06:19<14:32,15.86s/it][06:35<14:16,15.86s/it][06:51<14:01,15.87s/it][07:07<13:45,15.88s/it][07:23<13:30,15.88s/it][07:39<13:13,15.87s/it][07:54<12:55,15.83s/it][08:10<12:39,15.83s/it][08:26<12:23,15.83s/it][08:42<12:08,15.84s/it][08:58<11:53,15.85s/it][09:14<11:37,15.85s/it][09:29<11:21,15.84s/it][09:45<11:05,15.85s/it][10:01<10:49,15.84s/it][10:17<10:33,15.84s/it][10:33<10:17,15.84s/it][10:49<10:01,15.82s/it][11:04<09:44,15.80s/it][11:20<09:29,15.81s/it][11:36<09:14,15.84s/it][11:52<08:59,15.85s/it][12:08<08:43,15.85s/it][12:24<08:26,15.83s/it][12:39<08:10,15.81s/it][12:55<07:54,15.83s/it][13:11<07:39,15.85s/it][13:27<07:23,15.83s/it][13:43<07:07,15.84s/it][13:59<06:52,15.85s/it][14:15<06:36,15.86s/it][14:30<06:21,15.88s/it][14:46<06:05,15.87s/it][15:02<05:48,15.86s/it][15:18<05:32,15.83s/it][15:34<05:16,15.80s/it][15:49<05:00,15.79s/it][16:05<04:44,15.82s/it][16:21<04:28,15.82s/it][16:37<04:12,15.81s/it][16:53<03:57,15.80s/it][17:09<03:41,15.82s/it][17:24<03:25,15.81s/it][17:40<03:09,15.79s/it][17:56<02:53,15.81s/it][18:12<02:38,15.82s/it][18:28<02:22,15.81s/it][18:43<02:06,15.83s/it][18:59<01:50,15.80s/it][19:15<01:34,15.83s/it][19:31<01:19,15.82s/it][19:47<01:03,15.81s/it][20:02<00:47,15.81s/it][20:18<00:31,15.81s/it][20:34<00:15,15.82s/it][20:37<00:00,11.90s/it][20:37<00:00,15.66s/it][2025/03/25 20:48:57] - DeCowA - Run 79: Accuracy: 0.8818

[00:00<?,?it/s][00:15<20:34,15.83s/it][00:31<20:17,15.82s/it][00:47<20:02,15.82s/it][01:03<19:47,15.83s/it][01:19<19:30,15.82s/it][01:34<19:13,15.80s/it][01:50<18:57,15.79s/it][02:06<18:40,15.78s/it][02:22<18:24,15.78s/it][02:37<18:08,15.77s/it][02:53<17:52,15.77s/it][03:09<17:37,15.78s/it][03:25<17:22,15.80s/it][03:41<17:05,15.78s/it][03:56<16:49,15.77s/it][04:12<16:34,15.79s/it][04:28<16:20,15.82s/it][04:44<16:05,15.83s/it][05:00<15:48,15.81s/it][05:16<15:33,15.82s/it][05:31<15:15,15.79s/it][05:47<14:59,15.79s/it][06:03<14:42,15.77s/it][06:18<14:27,15.77s/it][06:34<14:11,15.77s/it][06:50<13:56,15.78s/it][07:06<13:40,15.77s/it][07:22<13:24,15.77s/it][07:37<13:08,15.76s/it][07:53<12:52,15.77s/it][08:09<12:37,15.79s/it][08:25<12:22,15.80s/it][08:41<12:08,15.83s/it][08:56<11:51,15.81s/it][09:12<11:34,15.79s/it][09:28<11:18,15.78s/it][09:44<11:02,15.77s/it][09:59<10:46,15.77s/it][10:15<10:30,15.77s/it][10:31<10:14,15.77s/it][10:47<09:59,15.77s/it][11:03<09:43,15.77s/it][11:18<09:27,15.76s/it][11:34<09:11,15.76s/it][11:50<08:55,15.74s/it][12:05<08:38,15.73s/it][12:21<08:23,15.72s/it][12:37<08:06,15.71s/it][12:53<07:51,15.72s/it][13:08<07:36,15.72s/it][13:24<07:20,15.74s/it][13:40<07:05,15.74s/it][13:56<06:49,15.75s/it][14:11<06:33,15.75s/it][14:27<06:17,15.75s/it][14:43<06:02,15.74s/it][14:59<05:46,15.75s/it][15:14<05:30,15.76s/it][15:30<05:14,15.75s/it][15:46<04:58,15.73s/it][16:01<04:42,15.71s/it][16:17<04:27,15.71s/it][16:33<04:11,15.74s/it][16:49<03:56,15.76s/it][17:05<03:41,15.79s/it][17:20<03:25,15.78s/it][17:36<03:09,15.79s/it][17:52<02:53,15.81s/it][18:08<02:37,15.78s/it][18:24<02:22,15.81s/it][18:39<02:06,15.82s/it][18:55<01:50,15.82s/it][19:11<01:34,15.82s/it][19:27<01:19,15.81s/it][19:43<01:03,15.81s/it][19:59<00:47,15.80s/it][20:14<00:31,15.79s/it][20:30<00:15,15.81s/it][20:33<00:00,11.95s/it][20:33<00:00,15.61s/it][2025/03/25 21:09:30] - DeCowA - Run 79: Accuracy: 0.8819
[2025/03/25 21:09:30] - DeCowA Mean: 0.8822, Std: 0.0005
[2025/03/25 21:09:30] - Testing done.

wandb: - 0.005 MB of 0.005 MB uploadedwandb: \ 0.005 MB of 0.005 MB uploadedwandb: | 0.005 MB of 0.005 MB uploadedwandb: / 0.013 MB of 0.017 MB uploaded (0.003 MB deduped)wandb: - 0.017 MB of 0.033 MB uploaded (0.003 MB deduped)wandb: \ 0.017 MB of 0.033 MB uploaded (0.003 MB deduped)wandb: | 0.017 MB of 0.033 MB uploaded (0.003 MB deduped)wandb: / 0.033 MB of 0.033 MB uploaded (0.003 MB deduped)wandb: 
wandb: Run history:
wandb: DeCowA_mean_adv ▁
wandb:  DeCowA_std_adv ▁
wandb:   FGSM_mean_adv ▁
wandb:    FGSM_std_adv ▁
wandb: Nature Acc Mean ▁
wandb:  Nature Acc Std ▁
wandb:   fmaa_mean_adv ▁
wandb:    fmaa_std_adv ▁
wandb:    pgn_mean_adv ▁
wandb:     pgn_std_adv ▁
wandb: 
wandb: Run summary:
wandb: DeCowA_mean_adv 0.8822
wandb:  DeCowA_std_adv 0.0005
wandb:   FGSM_mean_adv 0.84947
wandb:    FGSM_std_adv 0.00017
wandb: Nature Acc Mean 0.8907
wandb:  Nature Acc Std 0.0
wandb:   fmaa_mean_adv 0.88423
wandb:    fmaa_std_adv 0.00082
wandb:    pgn_mean_adv 0.86727
wandb:     pgn_std_adv 0.00143
wandb: 
wandb: 🚀 View run fanciful-disco-26 at: https://wandb.ai/xuanzhu_07-university-of-sydney/-Test-blacktransfer/runs/ows3vkis
wandb: ️⚡ View job at https://wandb.ai/xuanzhu_07-university-of-sydney/-Test-blacktransfer/jobs/QXJ0aWZhY3RDb2xsZWN0aW9uOjU5MDU0NTI2Mg==/version_details/v6
wandb: Synced 6 W&B file(s), 0 media file(s), 2 artifact file(s) and 0 other file(s)
wandb: Find logs at: ./wandb/run-20250325_180907-ows3vkis/logs
